[
  {
    "id": 23,
    "body": "cl_user1 joined the clan.",
    "kind": "system",
    "meta": {
      "event": "joined",
      "userId": "365935ce-d7ce-4970-9bab-51f0aee25a97"
    },
    "user": null,
    "createdAt": "2026-10-21T10:03:20Z"
  },
  {
    "id": 25,
    "body": "cl_user2 joined the clan.",
    "kind": "system",
    "meta": {
      "event": "joined",
      "userId": "8b35c542-1c71-4b6c-837b-f5b584d0a44a"
    },
    "user": null,
    "createdAt": "2026-10-21T10:03:20Z"
  },
  {
    "id": 27,
    "body": "cl_user3 joined the clan.",
    "kind": "system",
    "meta": {
      "event": "joined",
      "userId": "0b2b5ac7-c6e1-4c15-9dfe-94b155f07740"
    },
    "user": null,
    "createdAt": "2026-10-21T10:03:20Z"
  },
  {
    "id": 28,
    "body": "cl_user4 joined the clan.",
    "kind": "system",
    "meta": {
      "event": "joined",
      "userId": "2acc38c6-1608-437e-adb6-31e9c6310b10"
    },
    "user": null,
    "createdAt": "2026-10-21T10:03:20Z"
  },
  {
    "id": 29,
    "body": "cl_user5 joined the clan.",
    "kind": "system",
    "meta": {
      "event": "joined",
      "userId": "214898df-6c46-4634-bb76-1f45c607139e"
    },
    "user": null,
    "createdAt": "2026-10-21T10:03:20Z"
  },
  {
    "id": 30,
    "body": "cl_user6 joined the clan.",
    "kind": "system",
    "meta": {
      "event": "joined",
      "userId": "0580eb36-9ec8-4872-a32e-9601dfe4c645"
    },
    "user": null,
    "createdAt": "2026-10-21T10:03:20Z"
  },
  {
    "id": 35,
    "body": "cl_user2 is now co-leader.",
    "kind": "system",
    "meta": {
      "role": "co_leader",
      "event": "role",
      "userId": "8b35c542-1c71-4b6c-837b-f5b584d0a44a"
    },
    "user": null,
    "createdAt": "2026-10-21T10:03:20Z"
  },
  {
    "id": 36,
    "body": "cl_user3 is now elder.",
    "kind": "system",
    "meta": {
      "role": "elder",
      "event": "role",
      "userId": "0b2b5ac7-c6e1-4c15-9dfe-94b155f07740"
    },
    "user": null,
    "createdAt": "2026-10-21T10:03:20Z"
  },
  {
    "id": 37,
    "body": "Morning! you ****-hot people",
    "kind": "text",
    "meta": null,
    "user": {
      "id": "2acc38c6-1608-437e-adb6-31e9c6310b10",
      "username": "cl_user4",
      "avatarPreset": null
    },
    "createdAt": "2026-10-21T10:03:20Z"
  },
  {
    "id": 38,
    "body": "The Clan War has started!",
    "kind": "system",
    "meta": {
      "event": "war_started",
      "warId": "c6720b7b-b38e-426e-b1b6-8ff9cb34c2e9"
    },
    "user": null,
    "createdAt": "2026-10-21T10:03:20Z"
  },
  {
    "id": 40,
    "body": "cl_user4 left the clan.",
    "kind": "system",
    "meta": {
      "event": "left",
      "userId": "2acc38c6-1608-437e-adb6-31e9c6310b10"
    },
    "user": null,
    "createdAt": "2026-10-21T10:03:20Z"
  }
]
